{"schemaVersion":2,"id":"practice-专项-source-3b9b5ea1fd29","kind":"practice","title":"【未上传】梅州高中课程（可作答题）","year":"专项","region":"资料","variant":"可作答资料","instructions":[{"type":"paragraph","runs":[{"type":"text","text":"猜词技巧"}]}],"sections":[{"id":"section-legacy","title":"旧卷综合题型","instructions":[],"layout":"flow","groups":[{"id":"group-legacy","instructions":[],"stimulusBlocks":[{"type":"paragraph","runs":[{"type":"text","text":"avant-garde"}]},{"type":"paragraph","runs":[{"type":"text","text":"contiguous"}]},{"type":"paragraph","runs":[{"type":"text","text":"resourceful"}]},{"type":"paragraph","runs":[{"type":"text","text":"elusive"}]},{"type":"paragraph","runs":[{"type":"text","text":"distortion"}]},{"type":"paragraph","runs":[{"type":"text","text":"cosmetic"}]},{"type":"paragraph","runs":[{"type":"text","text":"cantankerous"}]},{"type":"paragraph","runs":[{"type":"text","text":"contour"}]},{"type":"paragraph","runs":[{"type":"text","text":"tractable"}]},{"type":"paragraph","runs":[{"type":"text","text":"euphoric"}]},{"type":"paragraph","runs":[{"type":"text","text":"1.\tArtists who are described as avant-garde are the first to experiment with new forms or concepts."}]},{"type":"paragraph","runs":[{"type":"text","text":"2.\tNations that share a border are, by definition, contiguous。"}]},{"type":"paragraph","runs":[{"type":"text","text":"3.\tAlthough often victims of circumstance, the heroines of Shakespearean comedy tend to be resourceful women, usually ready with a clever stratagem or verbal ploy for getting out of a difficult situation."}]},{"type":"paragraph","runs":[{"type":"text","text":"4.\tMany of our memories are elusive, escaping our consciousness just as we strain to recall a face or a name."}]},{"type":"paragraph","runs":[{"type":"text","text":"5.\tRepresenting a round world on a flat surface is impossible without some distortion: the Mercator projection map shows Greenland as over ten times larger than Mexico, a country in fact only slightly smaller than Greenland."}]},{"type":"paragraph","runs":[{"type":"text","text":"6.\tThe highly publicized redesign of the car is essentially cosmetic: the exterior has been updated, but the engine remains unchanged."}]},{"type":"paragraph","runs":[{"type":"text","text":"7.\tThe man’s colleagues characterized him as cantankerous because he had an irritable, quarrelsome disposition."}]},{"type":"paragraph","runs":[{"type":"text","text":"8. New data /measuring the contours of land /beneath the oceans /permit accurate generalizations about the topography of the seafloor."}]},{"type":"paragraph","runs":[{"type":"text","text":"9.\tBecause an older horse is more tractable than a younger one, it is safer for a novice rider."}]}],"sharedOptions":[],"questions":[{"id":"q-1","displayNumber":1,"sourceQuestionNumber":31,"type":"single_choice","promptBlocks":[{"type":"paragraph","runs":[{"type":"text","text":"What is the main idea of the text?"}]}],"placement":{"kind":"standalone"},"options":[{"id":"A","label":"A","blocks":[{"type":"paragraph","runs":[{"type":"text","text":"New languages will be created."}]}]},{"id":"B","label":"B","blocks":[{"type":"paragraph","runs":[{"type":"text","text":"People’s lifestyles are reflected in languages."}]}]},{"id":"C","label":"C","blocks":[{"type":"paragraph","runs":[{"type":"text","text":"Human development results in fewer languages."}]}]},{"id":"D","label":"D","blocks":[{"type":"paragraph","runs":[{"type":"text","text":"Geography determines language evolution."}]}]}],"blanks":[],"answerSpec":{"availability":"none","gradingMode":"none","kind":"none"},"explanationBlocks":[],"sourceRefs":[{"sourceDocumentId":"3b9b5ea1fd29a980a186a72e7f6006bd92ef40848adb826143616037330d2a46","relativePath":"其它/【未上传】梅州高中课程.docx","sha256":"3b9b5ea1fd29a980a186a72e7f6006bd92ef40848adb826143616037330d2a46","locator":{},"extractionMethod":"docx-xml","confidence":0.96}],"reviewStatus":"approved","dedupeSignature":{"questionContentFingerprint":"739a6c217126cf96dc4f645b19c02e66854a0c28972f540b99d5d377a46b47c0"}},{"id":"q-2","displayNumber":2,"sourceQuestionNumber":32,"type":"single_choice","promptBlocks":[{"type":"paragraph","runs":[{"type":"text","text":"What does the author think of new devices?"}]}],"placement":{"kind":"standalone"},"options":[{"id":"A","label":"A","blocks":[{"type":"paragraph","runs":[{"type":"text","text":"They are environment-friendly."}]}]},{"id":"B","label":"B","blocks":[{"type":"paragraph","runs":[{"type":"text","text":"They are no better than the old."}]}]},{"id":"C","label":"C","blocks":[{"type":"paragraph","runs":[{"type":"text","text":"They cost more to use at home."}]}]},{"id":"D","label":"D","blocks":[{"type":"paragraph","runs":[{"type":"text","text":"They go out of style quickly."}]}]}],"blanks":[],"answerSpec":{"availability":"none","gradingMode":"none","kind":"none"},"explanationBlocks":[],"sourceRefs":[{"sourceDocumentId":"3b9b5ea1fd29a980a186a72e7f6006bd92ef40848adb826143616037330d2a46","relativePath":"其它/【未上传】梅州高中课程.docx","sha256":"3b9b5ea1fd29a980a186a72e7f6006bd92ef40848adb826143616037330d2a46","locator":{},"extractionMethod":"docx-xml","confidence":0.96}],"reviewStatus":"approved","dedupeSignature":{"questionContentFingerprint":"1361310cccce6c48de1732ef0182bef73c72466bb32ad0bf55d03800b7e843d0"}},{"id":"q-3","displayNumber":3,"sourceQuestionNumber":33,"type":"single_choice","promptBlocks":[{"type":"paragraph","runs":[{"type":"text","text":"Why did Babbitt's team conduct the research?"}]}],"placement":{"kind":"standalone"},"options":[{"id":"A","label":"A","blocks":[{"type":"paragraph","runs":[{"type":"text","text":"To reduce the cost of minerals."}]}]},{"id":"B","label":"B","blocks":[{"type":"paragraph","runs":[{"type":"text","text":"To test the life cycle of a product."}]}]},{"id":"C","label":"C","blocks":[{"type":"paragraph","runs":[{"type":"text","text":"To update consumers on new technology."}]}]},{"id":"D","label":"D","blocks":[{"type":"paragraph","runs":[{"type":"text","text":"To find out electricity consumption of the devices."}]}]}],"blanks":[],"answerSpec":{"availability":"none","gradingMode":"none","kind":"none"},"explanationBlocks":[],"sourceRefs":[{"sourceDocumentId":"3b9b5ea1fd29a980a186a72e7f6006bd92ef40848adb826143616037330d2a46","relativePath":"其它/【未上传】梅州高中课程.docx","sha256":"3b9b5ea1fd29a980a186a72e7f6006bd92ef40848adb826143616037330d2a46","locator":{},"extractionMethod":"docx-xml","confidence":0.96}],"reviewStatus":"approved","dedupeSignature":{"questionContentFingerprint":"d6948306758dc8983c58b14f9b5b5d6abbda03a0d666c52724ef5e274a035036"}},{"id":"q-4","displayNumber":4,"sourceQuestionNumber":34,"type":"single_choice","promptBlocks":[{"type":"paragraph","runs":[{"type":"text","text":"Which of the following uses the least energy?"}]}],"placement":{"kind":"standalone"},"options":[{"id":"A","label":"A","blocks":[{"type":"paragraph","runs":[{"type":"text","text":"The box-set TV."}]}]},{"id":"B","label":"B","blocks":[{"type":"paragraph","runs":[{"type":"text","text":"The tablet."}]}]},{"id":"C","label":"C","blocks":[{"type":"paragraph","runs":[{"type":"text","text":"The LCD TV."}]}]},{"id":"D","label":"D","blocks":[{"type":"paragraph","runs":[{"type":"text","text":"The desktop computer."}]}]}],"blanks":[],"answerSpec":{"availability":"none","gradingMode":"none","kind":"none"},"explanationBlocks":[],"sourceRefs":[{"sourceDocumentId":"3b9b5ea1fd29a980a186a72e7f6006bd92ef40848adb826143616037330d2a46","relativePath":"其它/【未上传】梅州高中课程.docx","sha256":"3b9b5ea1fd29a980a186a72e7f6006bd92ef40848adb826143616037330d2a46","locator":{},"extractionMethod":"docx-xml","confidence":0.96}],"reviewStatus":"approved","dedupeSignature":{"questionContentFingerprint":"275a9b1b3c660e05f5384ae9f75b347c0f409783863edf8e6c0993888662a6c4"}},{"id":"q-5","displayNumber":5,"sourceQuestionNumber":35,"type":"single_choice","promptBlocks":[{"type":"paragraph","runs":[{"type":"text","text":"What does the text suggest people do about old electronic devices?"}]}],"placement":{"kind":"standalone"},"options":[{"id":"A","label":"A","blocks":[{"type":"paragraph","runs":[{"type":"text","text":"Stop using them."}]}]},{"id":"B","label":"B","blocks":[{"type":"paragraph","runs":[{"type":"text","text":"Take them apart."}]}]},{"id":"C","label":"C","blocks":[{"type":"paragraph","runs":[{"type":"text","text":"Upgrade them."}]}]},{"id":"D","label":"D","blocks":[{"type":"paragraph","runs":[{"type":"text","text":"Recycle them."}]}]}],"blanks":[],"answerSpec":{"availability":"answered","gradingMode":"auto","kind":"choice","acceptedAnswers":["A"],"normalization":{"unicodeNfkc":true,"trim":true,"collapseSpaces":true,"caseSensitive":false}},"explanationBlocks":[],"sourceRefs":[{"sourceDocumentId":"3b9b5ea1fd29a980a186a72e7f6006bd92ef40848adb826143616037330d2a46","relativePath":"其它/【未上传】梅州高中课程.docx","sha256":"3b9b5ea1fd29a980a186a72e7f6006bd92ef40848adb826143616037330d2a46","locator":{},"extractionMethod":"docx-xml","confidence":0.96}],"reviewStatus":"approved","dedupeSignature":{"questionContentFingerprint":"52b4f7616305fb217132f8df9999836adcbe0f2783eb9f98935ab0522266cf78","answerVariantFingerprint":"973002a580631b907845b4e29e1d3c68393b78263da3a0735f7a624481c256f3"}},{"id":"q-6","displayNumber":6,"sourceQuestionNumber":41,"type":"single_choice","promptBlocks":[],"placement":{"kind":"standalone"},"options":[{"id":"A","label":"A","blocks":[{"type":"paragraph","runs":[{"type":"text","text":"put forward"}]}]},{"id":"B","label":"B","blocks":[{"type":"paragraph","runs":[{"type":"text","text":"jumped at"}]}]},{"id":"C","label":"C","blocks":[{"type":"paragraph","runs":[{"type":"text","text":"tried out"}]}]},{"id":"D","label":"D","blocks":[{"type":"paragraph","runs":[{"type":"text","text":"turned down"}]}]}],"blanks":[],"answerSpec":{"availability":"answered","gradingMode":"auto","kind":"choice","acceptedAnswers":["A"],"normalization":{"unicodeNfkc":true,"trim":true,"collapseSpaces":true,"caseSensitive":false}},"explanationBlocks":[],"sourceRefs":[{"sourceDocumentId":"3b9b5ea1fd29a980